{
  "run_id": "R-TEST",
  "source": "cpu",
  "event_type": "sample",
  "time_mono_ns": 1,
  "time_range_ns": {"start": 1, "end": 1},
  "clock_source": "CLOCK_MONOTONIC",
  "collector_id": "cpu",
  "profile_id": "test",
  "payload": {},
  "data_quality": {
    "dropped": false,
    "drop_count": 0,
    "throttled": false,
    "missing": [],
    "truncated": false,
    "clock_confidence": "medium",
    "notes": []
  }
}
